src/mea_absorption_column/data/NCCC_2017_no_intercooler_cases.csv

case_no,campaign_year,source_file,source_subset,configuration,absorber_beds,intercoolers,absorber_lean_solvent_flow_kg_h,absorber_flue_gas_flow_kg_h,absorber_lean_solvent_temp_C,absorber_inlet_gas_temp_C,absorber_top_pressure_kPa,absorber_inlet_gas_pressure_kPa,absorber_lean_loading_mol_co2_per_mol_mea,absorber_lean_solvent_mea_weight_fraction,absorber_inlet_gas_co2_mole_fraction,absorber_inlet_gas_o2_mole_fraction,absorber_rich_solvent_flow_kg_h,absorber_rich_solvent_temp_C,absorber_outlet_gas_temp_C,absorber_rich_solvent_pressure_outlet_kPa,absorber_rich_solvent_pressure_after_pump_kPa,absorber_rich_loading_mol_co2_per_mol_mea,absorber_rich_mea_weight_fraction,absorber_outlet_gas_co2_mole_fraction,absorber_outlet_gas_o2_mole_fraction,absorber_capture_pct_avg,absorber_capture_pct_std,summary_table_capture_pct,reported_model_capture_pct,heat_exchanger_rich_solvent_inlet_temp_C,heat_exchanger_rich_solvent_outlet_temp_C,heat_exchanger_lean_solvent_inlet_temp_C,heat_exchanger_lean_solvent_outlet_temp_C,stripper_rich_solvent_inlet_temp_C,stripper_rich_solvent_inlet_pressure_kPa,stripper_top_pressure_kPa,stripper_reboiler_temp_C,stripper_lean_solvent_pressure_after_pump_kPa,stripper_reboiler_duty_kW,absorber_temperature_profile_C_01,absorber_temperature_profile_C_02,absorber_temperature_profile_C_03,absorber_temperature_profile_C_04,absorber_temperature_profile_C_05,absorber_temperature_profile_C_06,absorber_temperature_profile_C_07,absorber_temperature_profile_C_08,absorber_temperature_profile_C_09,absorber_temperature_profile_C_10,absorber_temperature_profile_C_11,absorber_temperature_profile_C_12
1C,2017,Morgan et al.md,2017 one-bed validation,"1 bed, no intercooling",1,0,6185.0,1997.0,,43.3,109.1,110.7,0.15,0.3,0.077,0.108,6830.0,55.0,64.3,111.8,672.2,0.36,0.32,0.003,0.118,97.1,0.7,97.1,95.4,55.9,112.5,119.8,57.7,111.8,446.0,186.6,121.9,276.0,431.0,,,,,,,,,,,,
2C,2017,Morgan et al.md,2017 one-bed validation,"1 bed, no intercooling",1,0,7765.0,2499.0,,43.1,109.6,112.5,0.2,0.3,0.077,0.109,8366.0,53.9,63.8,112.9,734.5,0.38,0.33,0.007,0.118,92.3,0.5,92.3,87.6,54.8,112.0,118.6,57.2,110.2,446.3,181.4,120.6,311.1,428.0,,,,,,,,,,,,
3C,2017,Morgan et al.md,2017 one-bed validation,"1 bed, no intercooling",1,0,7517.0,2013.0,,43.6,109.5,110.9,0.25,0.3,0.093,0.09,7765.0,56.4,65.3,112.3,723.7,0.47,0.31,0.012,0.099,89.5,1.2,89.5,84.0,57.3,111.5,117.5,59.6,108.4,446.4,180.7,119.9,287.4,352.0,,,,,,,,,,,,
4C,2017,Morgan et al.md,2017 one-bed validation,"1 bed, no intercooling",1,0,6160.0,1500.0,44.9,43.3,107.7,110.4,0.25,0.3,0.108,0.075,6954.0,57.9,50.9,109.4,677.1,0.42,0.31,0.014,0.084,88.9,0.8,88.9,87.6,59.0,110.8,116.4,60.9,106.9,446.0,181.9,119.5,273.8,299.0,,,,,,,,,,,,
5C,2017,Morgan et al.md,2017 one-bed validation,"1 bed, no intercooling",1,0,5237.0,1498.0,45.0,43.3,108.4,108.7,0.26,0.3,0.077,0.11,5976.0,55.9,49.4,109.8,643.9,0.42,0.3,0.013,0.118,86.4,0.6,86.4,87.3,56.8,109.8,115.2,58.9,106.6,445.8,181.7,118.3,274.0,285.0,,,,,,,,,,,,
6C,2017,Morgan et al.md,2017 one-bed validation,"1 bed, no intercooling",1,0,7665.0,2700.0,44.8,43.4,109.7,112.4,0.31,0.31,0.077,0.109,8356.0,50.5,50.4,112.5,734.7,0.39,0.31,0.037,0.115,60.2,0.5,60.2,58.8,51.5,107.1,112.9,54.3,103.0,446.7,182.2,118.3,273.4,288.0,,,,,,,,,,,,
7C,2017,Morgan et al.md,2017 one-bed validation,"1 bed, no intercooling",1,0,5414.0,1000.0,44.7,43.3,107.3,107.7,0.34,0.29,0.1,0.091,6127.0,53.9,41.9,108.5,649.6,0.43,0.3,0.03,0.098,76.4,2.2,76.4,78.8,54.7,105.2,110.3,56.7,101.9,446.5,181.5,115.7,273.6,198.0,,,,,,,,,,,,
1D,2017,Morgan et al.md,2017 two-bed validation,"2 beds, no intercooling",2,0,4912.0,1500.0,44.8,43.4,107.8,109.8,0.3,0.3,0.1,0.091,5600.0,51.6,55.5,111.0,635.0,0.39,0.31,0.024,0.099,78.4,2.2,77.8,80.1,52.5,107.6,113.5,54.8,101.7,444.7,179.5,116.6,272.8,189.0,,,,,,,,,,,,
2D,2017,Morgan et al.md,2017 two-bed validation,"2 beds, no intercooling",2,0,4600.0,2000.0,45.4,43.9,108.7,110.7,0.2,0.3,0.117,0.071,5244.0,48.5,61.7,111.7,628.7,0.47,0.3,0.026,0.08,80.5,0.2,80.5,81.2,49.3,109.8,117.1,51.5,101.4,446.4,179.9,118.9,273.7,271.0,,,,,,,,,,,,
3D,2017,Morgan et al.md,2017 two-bed validation,"2 beds, no intercooling",2,0,9534.0,2502.0,,44.9,110.0,114.3,0.3,0.3,0.093,0.09,10078.0,54.7,65.8,115.5,834.5,0.42,0.29,0.015,0.099,87.0,0.9,87.0,81.5,55.6,110.2,116.2,58.3,105.2,446.3,181.2,119.5,273.7,370.0,,,,,,,,,,,,
4D,2017,Morgan et al.md,2017 two-bed validation,"2 beds, no intercooling",2,0,4733.0,1966.0,46.3,43.1,108.6,110.9,0.2,0.3,0.079,0.107,5411.0,51.4,59.4,111.8,630.7,0.43,0.29,0.003,0.117,96.4,0.5,96.4,96.9,52.3,110.4,117.3,54.3,104.9,446.1,179.9,119.0,273.8,278.0,,,,,,,,,,,,

docs/papers/md/Morgan et al.md

\begin{table}
\captionsetup{labelformat=empty}
\caption{Table 3
First set of cases selected for 2017 MEA test campaign at NCCC.}
\begin{tabular}{|l|l|l|l|l|l|l|}
\hline Case No. & Lean Solvent Flowrate (kg/h) & Flue Gas Flowrate (kg/h) & Lean Solvent Loading (mol $\mathrm{CO}_{2} / \mathrm{mol}$ MEA) & Reboiler Duty (kW) & Flue Gas $\mathrm{CO}_{2}$ Mole Fraction & $\mathrm{CO}_{2}$ Capture Percentage (Model Prediction) \\
\hline 1* & 3911 & 1250 & 0.30 & 151 & 0.117 & 77.3 \\
\hline 2 & 3200 & 2250 & 0.25 & 157 & 0.093 & 54.8 \\
\hline 3* & 3800 & 2500 & 0.15 & 264 & 0.105 & 72.9 \\
\hline 4* & 9384 & 3000 & 0.25 & 470 & 0.117 & 89.3 \\
\hline 5 & 4171 & 3000 & 0.10 & 465 & 0.117 & 69.6 \\
\hline 6* & 6817 & 2250 & 0.30 & 264 & 0.117 & 72.8 \\
\hline 7 & 8186 & 3000 & 0.25 & 414 & 0.082 & 96.1 \\
\hline 8 & 3133 & 1750 & 0.30 & 120 & 0.082 & 61.0 \\
\hline 9* & 7946 & 3000 & 0.20 & 486 & 0.105 & 97.3 \\
\hline 10 & 3017 & 2750 & 0.10 & 336 & 0.105 & 60.8 \\
\hline 11 & 6514 & 2500 & 0.25 & 323 & 0.117 & 78.6 \\
\hline 12 & 3609 & 3000 & 0.15 & 252 & 0.082 & 71.8 \\
\hline 13 & 8024 & 2500 & 0.25 & 406 & 0.105 & 96.3 \\
\hline 14* & 9384 & 3000 & 0.25 & 470 & 0.117 & 89.3 \\
\hline 15 & 3230 & 2250 & 0.10 & 360 & 0.117 & 72.3 \\
\hline 16 & 6932 & 2750 & 0.20 & 417 & 0.117 & 90.2 \\
\hline 17* & 4341 & 2000 & 0.20 & 259 & 0.105 & 87.7 \\
\hline 18 & 3360 & 1500 & 0.20 & 199 & 0.117 & 83.7 \\
\hline 19 & 3370 & 2750 & 0.15 & 234 & 0.117 & 53.9 \\
\hline 20 & 4734 & 2250 & 0.15 & 331 & 0.117 & 90.6 \\
\hline
\end{tabular}
\end{table}

$$
\begin{equation*}
y_{\mathrm{CO}_{2}} \in[0.082-0.117] \mathrm{mol} \mathrm{CO}_{2} / \mathrm{mol} \mathrm{FG} \tag{7d}
\end{equation*}
$$

\begin{table}
\captionsetup{labelformat=empty}
\caption{Table 6
Results of one bed absorber test.}
\begin{tabular}{|l|l|l|l|l|l|l|}
\hline \multirow[t]{2}{*}{Data No.} & \multirow[t]{2}{*}{Lean Solvent Flowrate (kg/h)} & \multirow[t]{2}{*}{Flue Gas Flowrate (kg/h)} & \multirow[t]{2}{*}{Lean Solvent Loading (mol CO2/ mol MEA)} & \multirow[t]{2}{*}{Flue Gas $\mathrm{CO}_{2}$ Mole Fraction} & \multicolumn{2}{|l|}{$\mathrm{CO}_{2}$ Capture Percentage} \\
\hline & & & & & Data & Model \\
\hline 1C & 6185 & 1997 & 0.15 & 0.077 & 97.1 & 95.4 \\
\hline 2C & 7765 & 2499 & 0.20 & 0.077 & 92.3 & 87.6 \\
\hline 3C & 7517 & 2013 & 0.25 & 0.093 & 89.5 & 84.0 \\
\hline 4C & 6160 & 1500 & 0.25 & 0.108 & 88.9 & 87.6 \\
\hline 5C & 5237 & 1498 & 0.26 & 0.077 & 86.4 & 87.3 \\
\hline 6C & 7665 & 2700 & 0.31 & 0.077 & 60.2 & 58.8 \\
\hline 7C & 5414 & 1000 & 0.34 & 0.100 & 76.4 & 78.8 \\
\hline
\end{tabular}
\end{table}

\begin{table}
\captionsetup{labelformat=empty}
\caption{Table 7
Results of two bed absorber test.}
\begin{tabular}{|l|l|l|l|l|l|l|}
\hline \multirow[t]{2}{*}{Data No.} & \multirow[t]{2}{*}{Lean Solvent Flowrate (kg/h)} & \multirow[t]{2}{*}{Flue Gas Flowrate (kg/h)} & \multirow[t]{2}{*}{Lean Solvent Loading (mol CO2/mol MEA)} & \multirow[t]{2}{*}{Flue Gas CO2 Mole Fraction} & \multicolumn{2}{|l|}{$\mathrm{CO}_{2}$ Capture Percentage} \\
\hline & & & & & Data & Model \\
\hline 1D & 4912 & 1500 & 0.30 & 0.100 & 77.8 & 80.1 \\
\hline 2D & 4600 & 2000 & 0.20 & 0.117 & 80.5 & 81.2 \\
\hline 3D & 9534 & 2502 & 0.30 & 0.093 & 87.0 & 81.5 \\
\hline 4D & 4733 & 1966 & 0.20 & 0.079 & 96.4 & 96.9 \\
\hline
\end{tabular}
\end{table}

\begin{table}
\captionsetup{labelformat=empty}
\caption{Table A1
Data obtained during 2017 MEA campaign at NCCC (Absorber-Part 1).}
\begin{tabular}{|l|l|l|l|l|l|l|l|}
\hline Case & Lean Solvent Flowrate (kg/h) & Inlet Flue Gas Flowrate (kg/h) & Lean Solvent Temperature ( ${ }^{\circ} \mathrm{C}$ ) & Inlet Flue Gas Temperature ( ${ }^{\circ} \mathrm{C}$ ) & Absorber Top Pressure (kPa) & Inlet Flue Gas Pressure (kPa) & Lean Solvent CO2 Loading ( $\mathrm{mol} \mathrm{CO} 2 / \mathrm{mol}$ MEA) \\
\hline 1A & 8180 & 3000 & 44.1 & 43.4 & 109.4 & 115.2 & 0.24 \\
\hline 2A & 7130 & 2690 & 44.9 & 45.2 & 109.5 & 114.6 & 0.25 \\
\hline 3A & 3354 & 1500 & 45.6 & 43.3 & 107.9 & 110.1 & 0.24 \\
\hline 4A & 3600 & 3000 & 45.6 & 43.4 & 110.2 & 113.6 & 0.19 \\
\hline 5A & 3380 & 2750 & 45.5 & 45.7 & 109.8 & 112.8 & 0.20 \\
\hline 6A & 3130 & 1750 & 45.1 & 43.4 & 108.2 & 109.9 & 0.31 \\
\hline 7A & 4730 & 2255 & 45.1 & 43.5 & 109.2 & 111.8 & 0.23 \\
\hline 8A & 3230 & 2240 & 44.8 & 42.8 & 109.2 & 110.9 & 0.24 \\
\hline 9A & 3224 & 2245 & 45.9 & 43.4 & 108.8 & 111.6 & 0.14 \\
\hline 10A & 7980 & 2492 & 44.8 & 43.1 & 109.0 & 114.5 & 0.32 \\
\hline 11A & 3016 & 2761 & 45.8 & 42.9 & 109.6 & 111.9 & 0.16 \\
\hline 12A & 4170 & 2920 & 46.4 & 45.1 & 109.7 & 114.0 & 0.14 \\
\hline 13A & 6910 & 2680 & 44.9 & 44.6 & 109.3 & 114.9 & 0.26 \\
\hline 14A & 6505 & 2500 & 44.8 & 43.5 & 109.2 & 112.9 & 0.31 \\
\hline 15A & 8000 & 2494 & 44.9 & 42.9 & 109.1 & 114.2 & 0.32 \\
\hline 1B & 7959 & 2497 & 44.4 & 43.7 & 109.7 & 115.2 & 0.30 \\
\hline 2B & 9871 & 2746 & 44.7 & 45.7 & 109.5 & 117.0 & 0.30 \\
\hline 3B & 11,412 & 2748 & 44.4 & 47.3 & 109.2 & 113.0 & 0.30 \\
\hline 1C & 6185 & 1997 & NA & 43.3 & 109.1 & 110.7 & 0.15 \\
\hline 2C & 7765 & 2499 & NA & 43.1 & 109.6 & 112.5 & 0.20 \\
\hline 3C & 7517 & 2013 & NA & 43.6 & 109.5 & 110.9 & 0.25 \\
\hline 4C & 6160 & 1500 & 44.9 & 43.3 & 107.7 & 110.4 & 0.25 \\
\hline 5C & 5237 & 1498 & 45.0 & 43.3 & 108.4 & 108.7 & 0.26 \\
\hline 6C & 7665 & 2700 & 44.8 & 43.4 & 109.7 & 112.4 & 0.31 \\
\hline 7C & 5414 & 1000 & 44.7 & 43.3 & 107.3 & 107.7 & 0.34 \\
\hline 1D & 4912 & 1500 & 44.8 & 43.4 & 107.8 & 109.8 & 0.30 \\
\hline 2D & 4600 & 2000 & 45.4 & 43.9 & 108.7 & 110.7 & 0.20 \\
\hline 3D & 9534 & 2502 & NA & 44.9 & 110.0 & 114.3 & 0.30 \\
\hline 4D & 4733 & 1966 & 46.3 & 43.1 & 108.6 & 110.9 & 0.20 \\
\hline
\end{tabular}
\end{table}