src/mea_absorption_column/data/NCCC_no_intercooler_case_options.csv

case_no,campaign_year,source_file,source_subset,configuration,absorber_beds,intercoolers,lean_solvent_flow_kg_h,flue_gas_flow_kg_h,lean_solvent_temp_C,inlet_gas_temp_C,absorber_pressure_kPa,lean_loading_mol_co2_per_mol_mea,w_MEA,y_CO2,y_O2,co2_capture_pct,co2_capture_std_pct,reported_model_capture_pct
K13,2014,Morgan et al. - 2018 - Development of a Rigorous Modeling Framework for Solvent-Based CO2 Capture.md,2014 K campaign,"3 beds, no intercooling",3,0,6804.0,2238.0,41.93,42.09,107.56,0.164,0.303,0.0935,,97.98,,98.36
K17,2014,Morgan et al. - 2018 - Development of a Rigorous Modeling Framework for Solvent-Based CO2 Capture.md,2014 K campaign,"2 beds, no intercooling",2,0,6804.0,2240.0,42.03,41.03,108.12,0.168,0.307,0.0919,,97.61,,98.18
K18,2014,Morgan et al. - 2018 - Development of a Rigorous Modeling Framework for Solvent-Based CO2 Capture.md,2014 K campaign,"1 bed, no intercooling",1,0,6804.0,2271.0,42.24,46.07,109.18,0.141,0.302,0.10189999999999999,,92.85,,94.36
K19,2014,Morgan et al. - 2018 - Development of a Rigorous Modeling Framework for Solvent-Based CO2 Capture.md,2014 K campaign,"1 bed, no intercooling",1,0,11793.0,1440.0,40.9,46.18,108.02,0.184,0.278,0.11,,98.21,,98.91
K20,2014,Morgan et al. - 2018 - Development of a Rigorous Modeling Framework for Solvent-Based CO2 Capture.md,2014 K campaign,"1 bed, no intercooling",1,0,3175.0,1324.0,45.3,46.09,108.12,0.075,0.276,0.10980000000000001,,95.55,,98.02
K21,2014,Morgan et al. - 2018 - Development of a Rigorous Modeling Framework for Solvent-Based CO2 Capture.md,2014 K campaign,"2 beds, no intercooling",2,0,3175.0,1366.0,45.18,46.11,107.76,0.074,0.271,0.1018,,96.32,,99.72
1C,2017,Morgan et al.md,2017 one-bed validation,"1 bed, no intercooling",1,0,6185.0,1997.0,,43.3,109.1,0.15,0.3,0.077,0.108,97.1,0.7,95.4
2C,2017,Morgan et al.md,2017 one-bed validation,"1 bed, no intercooling",1,0,7765.0,2499.0,,43.1,109.6,0.2,0.3,0.077,0.109,92.3,0.5,87.6
3C,2017,Morgan et al.md,2017 one-bed validation,"1 bed, no intercooling",1,0,7517.0,2013.0,,43.6,109.5,0.25,0.3,0.093,0.09,89.5,1.2,84.0
4C,2017,Morgan et al.md,2017 one-bed validation,"1 bed, no intercooling",1,0,6160.0,1500.0,44.9,43.3,107.7,0.25,0.3,0.108,0.075,88.9,0.8,87.6
5C,2017,Morgan et al.md,2017 one-bed validation,"1 bed, no intercooling",1,0,5237.0,1498.0,45.0,43.3,108.4,0.26,0.3,0.077,0.11,86.4,0.6,87.3
6C,2017,Morgan et al.md,2017 one-bed validation,"1 bed, no intercooling",1,0,7665.0,2700.0,44.8,43.4,109.7,0.31,0.31,0.077,0.109,60.2,0.5,58.8
7C,2017,Morgan et al.md,2017 one-bed validation,"1 bed, no intercooling",1,0,5414.0,1000.0,44.7,43.3,107.3,0.34,0.29,0.1,0.091,76.4,2.2,78.8
1D,2017,Morgan et al.md,2017 two-bed validation,"2 beds, no intercooling",2,0,4912.0,1500.0,44.8,43.4,107.8,0.3,0.3,0.1,0.091,78.4,2.2,80.1
2D,2017,Morgan et al.md,2017 two-bed validation,"2 beds, no intercooling",2,0,4600.0,2000.0,45.4,43.9,108.7,0.2,0.3,0.117,0.071,80.5,0.2,81.2
3D,2017,Morgan et al.md,2017 two-bed validation,"2 beds, no intercooling",2,0,9534.0,2502.0,,44.9,110.0,0.3,0.3,0.093,0.09,87.0,0.9,81.5
4D,2017,Morgan et al.md,2017 two-bed validation,"2 beds, no intercooling",2,0,4733.0,1966.0,46.3,43.1,108.6,0.2,0.3,0.079,0.107,96.4,0.5,96.9

docs/papers/md/Morgan et al.md

$$
\begin{equation*}
y_{\mathrm{CO}_{2}} \in[0.082-0.117] \mathrm{mol} \mathrm{CO}_{2} / \mathrm{mol} \mathrm{FG} \tag{7d}
\end{equation*}
$$

\begin{table}
\captionsetup{labelformat=empty}
\caption{Table 6
Results of one bed absorber test.}
\begin{tabular}{|l|l|l|l|l|l|l|}
\hline \multirow[t]{2}{*}{Data No.} & \multirow[t]{2}{*}{Lean Solvent Flowrate (kg/h)} & \multirow[t]{2}{*}{Flue Gas Flowrate (kg/h)} & \multirow[t]{2}{*}{Lean Solvent Loading (mol CO2/ mol MEA)} & \multirow[t]{2}{*}{Flue Gas $\mathrm{CO}_{2}$ Mole Fraction} & \multicolumn{2}{|l|}{$\mathrm{CO}_{2}$ Capture Percentage} \\
\hline & & & & & Data & Model \\
\hline 1C & 6185 & 1997 & 0.15 & 0.077 & 97.1 & 95.4 \\
\hline 2C & 7765 & 2499 & 0.20 & 0.077 & 92.3 & 87.6 \\
\hline 3C & 7517 & 2013 & 0.25 & 0.093 & 89.5 & 84.0 \\
\hline 4C & 6160 & 1500 & 0.25 & 0.108 & 88.9 & 87.6 \\
\hline 5C & 5237 & 1498 & 0.26 & 0.077 & 86.4 & 87.3 \\
\hline 6C & 7665 & 2700 & 0.31 & 0.077 & 60.2 & 58.8 \\
\hline 7C & 5414 & 1000 & 0.34 & 0.100 & 76.4 & 78.8 \\
\hline
\end{tabular}
\end{table}

\begin{table}
\captionsetup{labelformat=empty}
\caption{Table 7
Results of two bed absorber test.}
\begin{tabular}{|l|l|l|l|l|l|l|}
\hline \multirow[t]{2}{*}{Data No.} & \multirow[t]{2}{*}{Lean Solvent Flowrate (kg/h)} & \multirow[t]{2}{*}{Flue Gas Flowrate (kg/h)} & \multirow[t]{2}{*}{Lean Solvent Loading (mol CO2/mol MEA)} & \multirow[t]{2}{*}{Flue Gas CO2 Mole Fraction} & \multicolumn{2}{|l|}{$\mathrm{CO}_{2}$ Capture Percentage} \\
\hline & & & & & Data & Model \\
\hline 1D & 4912 & 1500 & 0.30 & 0.100 & 77.8 & 80.1 \\
\hline 2D & 4600 & 2000 & 0.20 & 0.117 & 80.5 & 81.2 \\
\hline 3D & 9534 & 2502 & 0.30 & 0.093 & 87.0 & 81.5 \\
\hline 4D & 4733 & 1966 & 0.20 & 0.079 & 96.4 & 96.9 \\
\hline
\end{tabular}
\end{table}

\begin{table}
\captionsetup{labelformat=empty}
\caption{Table A1 (continued)}
\begin{tabular}{|l|l|l|l|l|l|l|l|}
\hline \multicolumn{8}{|l|}{Data obtained during 2017 MEA campaign at NCCC (Absorber-Part 3).} \\
\hline Case & Rich Solvent Pressure (After Pump ${ }^{\mathrm{c}}$ ) (kPa) & Rich Solvent CO2 Loading (mol CO2/mol MEA) & Rich Solvent MEA Mass Fraction & Outlet Flue Gas $\mathrm{CO}_{2}$ Mole Fraction & Outlet Flue Gas $\mathrm{O}_{2}$ Mole Fraction & Number of Beds (Intercoolers) Used & $\mathrm{CO}_{2}$ Capture Percentage (Average ± Standard Deviation) \\
\hline 4A & 601.8 & 0.46 & 0.32 & 0.027 & 0.118 & 3 (2) & $70.6 \pm 1.1$ \\
\hline 5A & 587.4 & 0.42 & 0.33 & 0.062 & 0.078 & 3 (2) & $53.9 \pm 2.6$ \\
\hline 6A & 591.5 & 0.46 & 0.30 & 0.044 & 0.115 & 3 (2) & $51.7 \pm 0.9$ \\
\hline 7A & 634.8 & 0.46 & 0.32 & 0.037 & 0.079 & 3 (2) & $72.5 \pm 1.0$ \\
\hline 8A & 578.3 & 0.46 & 0.31 & 0.057 & 0.078 & 3 (2) & $56.3 \pm 1.8$ \\
\hline 9A & 578.4 & 0.46 & 0.31 & 0.034 & 0.080 & 3 (2) & $74.2 \pm 0.6$ \\
\hline 10A & 756.2 & 0.47 & 0.30 & 0.026 & 0.080 & 3 (2) & $79.9 \pm 0.6$ \\
\hline 11A & 573.9 & 0.45 & 0.31 & 0.046 & 0.090 & 3 (2) & $60.5 \pm 1.7$ \\
\hline 12A & 603.3 & 0.46 & 0.31 & 0.033 & 0.080 & 3 (2) & $75.4 \pm 0.8$ \\
\hline 13A & 704.6 & 0.47 & 0.32 & 0.026 & 0.080 & 3 (2) & $80.6 \pm 0.6$ \\
\hline 14A & 687.1 & 0.47 & 0.31 & 0.055 & 0.077 & 3 (2) & $57.8 \pm 0.7$ \\
\hline 15A & 753.5 & 0.48 & 0.30 & 0.032 & 0.079 & 3 (2) & $76.8 \pm 1.4$ \\
\hline 1B & 835.2 & 0.48 & 0.29 & 0.003 & 0.120 & 3 (2) & $96.1 \pm 0.1$ \\
\hline 2B & 898.4 & 0.47 & 0.28 & 0.003 & 0.108 & 3 (2) & $97.7 \pm 0.5$ \\
\hline 3B & 961.2 & 0.50 & NA & 0.007 & 0.081 & 3 (2) & $94.8 \pm 0.1$ \\
\hline 1C & 672.2 & 0.36 & 0.32 & 0.003 & 0.118 & 1 (0) & $97.1 \pm 0.7$ \\
\hline 2C & 734.5 & 0.38 & 0.33 & 0.007 & 0.118 & 1 (0) & $92.3 \pm 0.5$ \\
\hline 3C & 723.7 & 0.47 & 0.31 & 0.012 & 0.099 & 1 (0) & $89.5 \pm 1.2$ \\
\hline 4C & 677.1 & 0.42 & 0.31 & 0.014 & 0.084 & 1 (0) & $88.9 \pm 0.8$ \\
\hline 5C & 643.9 & 0.42 & 0.30 & 0.013 & 0.118 & 1 (0) & $86.4 \pm 0.6$ \\
\hline 6C & 734.7 & 0.39 & 0.31 & 0.037 & 0.115 & 1 (0) & $60.2 \pm 0.5$ \\
\hline 7C & 649.6 & 0.43 & 0.30 & 0.030 & 0.098 & 1 (0) & $76.4 \pm 2.2$ \\
\hline 1D & 635.0 & 0.39 & 0.31 & 0.024 & 0.099 & 2 (0) & $78.4 \pm 2.2$ \\
\hline 2D & 628.7 & 0.47 & 0.30 & 0.026 & 0.080 & 2 (0) & $80.5 \pm 0.2$ \\
\hline 3D & 834.5 & 0.42 & 0.29 & 0.015 & 0.099 & 2 (0) & $87.0 \pm 0.9$ \\
\hline 4D & 630.7 & 0.43 & 0.29 & 0.003 & 0.117 & 2 (0) & $96.4 \pm 0.5$ \\
\hline
\end{tabular}
\end{table}
${ }^{\mathrm{a}}$ Solvent MEA fraction is represented on a $\mathrm{CO}_{2}$-free basis.
${ }^{\mathrm{b}}$ Flue gas composition is presented on a $\mathrm{H}_{2} \mathrm{O}$-free (dry) basis throughout this paper. Values for the $\mathrm{CO}_{2}$ and $\mathrm{O}_{2}$ mole fraction are presented, and the balance is $\mathrm{N}_{2}$. The $\mathrm{H}_{2} \mathrm{O}$ content of the inlet flue gas stream may be reasonably estimated by assuming that the flue gas is saturated with $\mathrm{H}_{2} \mathrm{O}$ at the specified values of temeprature and pressure (both given in Part 1 of Table A1).
${ }^{\mathrm{c}}$ Labeled as 'Rich Solvent Pump' in Fig. 2.